违规明细,,,,,,,,,,,,,,
代码,名称,公告日期,违规类型,处罚对象,关系,违规行为,处分类型,处分措施,处理人,处罚金额(万元),相关法规,是否发债,证监会行业(2012),东财行业
002231.SZ,奥维通信,2016-08-23,未依法履行其他职责,奥维通信股份有限公司,公司本身,"公司2016年8月3日披露的《关于收到中标通知书的提示性公告》公告内容不完整,且未按照《深圳证券交易所上市公司信息披露公告格式》进行披露。深交所要求公司在2016年8月22日前及时提出整改措施并对外披露,杜绝上述问题的再次发生。",监管措施,"深交所要求公司在2016年8月22日前及时提出整改措施并对外披露,杜绝上述问题的再次发生。",深圳证券交易所,,《深圳证券交易所上市公司信息披露公告格式》,否,制造业,通信配套服务
600225.SH,天津松江,2016-08-23,未依法履行其他职责,天津滨海发展投资控股有限公司,公司股东,"经查,我局发现你公司超期未履行于2013年12月10日、2014年9月5日作出的解决与公司控股子公司天津松江股份有限公司间同业竞争问题的相关承诺事项,承诺事项主要情况如下:你公司投资建设了天津梅江南团结大厦及周边商业街项目,你公司控股子公司天津松江生态建设开发有限公司投资建设了宝坻上河苑、上林苑项目,2013年12月10日你公司承诺:“对上述团结大厦及周边商业项目和宝坻上河苑、上林苑项目暂时利用自身品牌、资源、财务等优势代为培育,并承诺不进行销售,待培育成熟时,天津松江在同等条件下有优先受让全部资产的权利,如届时天津松江放弃优先受让权,本公司将向无关联的第三方转让”,并于2014年9月5日补充承诺:“上述项目在本公司的培育期不超过2015年12月31日。在培育期结束 6个月内,本公司将通过公开市场对上述项目产权进行转让。天津松江在同等条件下有优先受让全部资产的权利。如届时天津松江放弃优先受让权,本公司将向无关联的第三方转让。”截至2016年6月30日,你公司上述承诺事项未履行完毕。",要求提交书面承诺,"上述行为违反了《上市公司监管指引第4号―上市公司实际控制人、股东、关联方、收购人以及上市公司承诺及履行》的规定。按照《上市公司监管指引第4号―上市公司实际控制人、股东、关联方、收购人以及上市公司承诺及履行》的规定,现要求你公司在2017年3月31日前予以改正,并向我局提交书面报告。",中国证券监督管理委员会天津监管局,,《上市公司监管指引第4号―上市公司实际控制人、股东、关联方、收购人以及上市公司承诺及履行》,否,房地产业,房地产
601238.SH,广汽集团,2016-08-23,涉嫌违反证券法律法规,李平一,公司高管,"2016年7月13日,公司董事李平一先生股票帐户买入公司股票100股,成交均价为21.71元/股;2016年7月14日,公司董事李平一先生股票帐户卖出公司股票100股,成交均价为22.11元/股;李平一先生的上述行为违反了《证券法》第四十七条的规定,构成了短线交易。",内部通报批评,"1、依据《证券法》第四十七条的规定,上市公司董事短线交易产生的收益应收归公司所有。按照本次李平一先生六个月内买入又卖出公司股票计算,上述短线交易产生的收益40元上缴归公司所有。 
2、李平一先生股票帐户的本次短线交易行为系其亲属操作失误造成,其本人已认识到本次违规事项的严重性,并就本次行为向公司及广大投资者表示歉意,同时承诺将自觉遵守《证券法》第四十七条关于禁止短线交易的规定,认真学习相关法律、法规,严格规范买卖本公司股票的行为,加强对其亲属及股票账户管理,切实履行自己的职责和义务。 
经公司核查,李平一先生股票帐户的上述交易行为未发生在公司信息披露的本公司及董事会全体成员保证公告内容不存在虚假记载、误导性陈述或者重大遗漏,并对其内容的真实、准确和完整承担个别及连带责任。 敏感期内,亦不存在因知悉内幕信息而交易公司股票的情况。 公司董事会向全体董事、监事、高级管理人员对李平一先生股票帐户的短线交易行为进行了通报,并要求引以为戒。",广州汽车集团股份有限公司,,《证券法》,是,制造业,乘用车
,,,,,,,,,,,,,,
数据来源:东方财富Choice数据,,,,,,,,,,,,,,
